field,laureate_id,laureate_name,prize_year,title,pub_year,paper_id,additional_info,doi,uid,nonenglish,no_record
Physics,10137,"lee, td",1957,question of parity conservation in weak interactions,1956,2157338954,,10.1103/PhysRev.104.254,WOS:A1956WK97500047,0,0
Physics,10116,"alvarez, lw",1968,catalysis of nuclear reactions by mu mesons,1957,2327634809,,10.1103/PhysRev.105.1127,WOS:A1957WB71600068,0,0
Physics,10069,"dehmelt, hg",1989,slow spin relaxation of optically polarized sodium atoms,1957,1969076679,,10.1103/PhysRev.105.1487,WOS:A1957WB71800018,0,0
Physics,10069,"dehmelt, hg",1989,modulation of a light beam by precessing absorbing atoms,1957,1968293554,,10.1103/PhysRev.105.1924,WOS:A1957WB71900037,0,0
Physics,10109,"schrieffer, jr",1972,theory of superconductivity,1957,2014437371,,10.1103/PhysRev.108.1175,WOS:A1957WB73600012,0,0
Physics,10097,"anderson, pw",1977,absence of diffusion in certain random lattices,1958,2264002775,,10.1103/PhysRev.109.1492,WOS:A1958WB74200013,0,0
Physics,10115,"gellmann, m",1969,theory of the fermi interaction,1958,1508439018,,10.1103/PhysRev.109.193,WOS:A1958WB73800032,0,0
Physics,10069,"dehmelt, hg",1989,spin resonance of free electrons polarized by exchange collisions,1958,2013364211,,10.1103/PhysRev.109.381,WOS:A1958WB73900025,0,0
Physics,10106,"esaki, l",1973,new phenomenon in narrow germanium p n junctions,1958,1968666095,,10.1103/PhysRev.109.603,WOS:A1958WB73900064,0,0
Physics,10060,"brockhouse, bn",1994,normal modes of germanium by neutron spectrometry,1958,2065464894,,10.1103/PhysRev.111.747,WOS:A1958WB75200014,0,0
Physics,10086,"schawlow, al",1981,infrared and optical masers,1958,1964347990,,10.1103/PhysRev.112.1940,WOS:A1958WB76100016,0,0
Physics,10021,"nambu, yoichiro",2008,quasi particles and gauge invariance in the theory of superconductivity,1960,1965850850,,10.1103/PhysRev.117.648,WOS:A1960WB78800004,0,0
Physics,10107,"giaever, i",1973,study of superconductors by electron tunneling,1961,2067175510,,10.1103/PhysRev.122.1101,WOS:A19611447C00023,0,0
Physics,10021,"nambu, yoichiro",2008,dynamical model of elementary particles based on an analogy with superconductivity ii,1961,1998909324,,10.1103/PhysRev.122.345,WOS:A19611444C00030,0,0
Physics,10115,"gellmann, m",1969,symmetries of baryons and mesons,1962,2226963368,,10.1103/PhysRev.125.1067,WOS:A19621464C00014,0,0
Physics,10087,"bloember, n",1981,interactions between light waves in a nonlinear dielectric,1962,2020687655,,10.1103/PhysRev.127.1918,WOS:A19621479C00002,0,0
Physics,10087,"bloember, n",1981,light waves at the boundary of nonlinear media,1962,2109537480,,10.1103/PhysRev.128.606,WOS:A19621481C00009,0,0
Physics,10028,"glauber, rj",2005,the quantum theory of optical coherence,1963,2592799394,,10.1103/PhysRev.130.2529,WOS:A19631497C00028,0,0
Physics,10028,"glauber, rj",2005,coherent and incoherent states of the radiation field,1963,2228259595,,10.1103/PhysRev.131.2766,WOS:A19631503C00025,0,0
Chemistry,20046,"kohn, w",1998,inhomogeneous electron gas,1964,2030976617,,10.1103/PhysRev.136.B864,WOS:A19641557C00018,0,0
Chemistry,20046,"kohn, w",1998,self consistent equations including exchange and correlation effects,1965,2230728100,,10.1103/PhysRev.140.A1133,WOS:A19657000000015,0,0
Physics,10035,"leggett, aj",2003,theory of a superfluid fermi liquid i general formalism and static properties,1965,2086145101,,10.1103/PhysRev.140.A1869,WOS:A19657080900006,0,0
Physics,10067,"kendall, hw",1990,measurements of elastic electron deuteron scattering at high momentum transfers,1969,2067610198,,10.1103/PhysRev.177.2075,WOS:A1969C983500021,0,0
Physics,10172,"compton, ah",1927,a quantum theory of the scattering of x rays by light elements,1923,2035879262,,10.1103/PhysRev.21.483,WOS:000201530300001,0,0
Physics,10172,"compton, ah",1927,the spectrum of scattered x rays,1923,1992738745,,10.1103/PhysRev.22.409,WOS:000201530900001,0,0
Physics,10166,"schrodinger, e",1933,an undulatory theory of the mechanics of atoms and molecules,1926,2056474482,,10.1103/PhysRev.28.1049,WOS:000201517600001,0,0
Physics,10155,"bridgman, pw",1946,change of phase under pressure i the phase diagram of eleven substances with especial reference to the melting curve,1914,1997867994,,10.1103/PhysRev.3.126,WOS:000201502000006,0,0
Physics,10161,"davisson, cj",1937,diffraction of electrons by a crystal of nickel,1927,2059898013,,10.1103/PhysRev.30.705,WOS:000201553700001,0,0
Physics,10159,"lawrence, eo",1939,the production of heavy high speed ions without the use of high voltages,1931,2050884299,,10.1103/PhysRev.38.2021,WOS:000201554800012,0,0
Chemistry,20100,"onsager, l",1968,reciprocal relations in irreversible processes ii,1931,2002116790,,10.1103/PhysRev.38.2265,WOS:000201554900017,0,0
Chemistry,20144,"urey, h",1934,a hydrogen isotope of mass 2,1932,2035264337,,10.1103/PhysRev.39.164,WOS:000201555000020,0,0
Physics,10159,"lawrence, eo",1939,the production of high speed light ions without the use of high voltages,1931,2041154484,,10.1103/PhysRev.40.19,WOS:000201590900003,0,0
Physics,10127,"wigner, ep",1963,on the quantum correction for thermodynamic equilibrium,1932,2031147858,,10.1103/PhysRev.40.749,WOS:000201591300009,0,0
Physics,10098,"van vleck, jh",1977,theory of the variations in paramagnetic anisotropy among different salts of the iron group,1932,1996895697,,10.1103/PhysRev.41.208,WOS:000201555700010,0,0
Physics,10164,"anderson, cd",1936,the positive electron,1933,1984005161,,10.1103/PhysRev.43.491,WOS:000201518200012,0,0
Chemistry,20127,"giauque, w",1949,attainment of temperatures below 1 absolute by demagnetization ofgd2 so4 3 8h2o,1933,1621230895,,10.1103/PhysRev.43.768,WOS:000201518500025,0,0
Physics,10152,"yukawa, h",1949,on the nuclear transformation with the absorption of the orbital electron,1937,1973587862,,10.1103/PhysRev.51.677.2,WOS:000201592800016,0,0
Physics,10157,"rabi, ii",1944,a new method of measuring nuclear magnetic moment,1938,2037363234,,10.1103/PhysRev.53.318,WOS:000201556500016,0,0
Physics,10114,"alfven, h",1970,on the motion of cosmic rays in interstellar space,1939,1964244046,,10.1103/PhysRev.55.425,WOS:000201579000001,0,0
Physics,10117,"bethe, ha",1967,energy production in stars,1939,2051756823,,10.1103/PhysRev.55.434,WOS:000201579000003,0,0
Chemistry,20124,"mcmillan, e",1951,radioactive element 93,1940,2065744907,,10.1103/PhysRev.57.1185.2,WOS:000201629200021,0,0
Physics,10128,"landau, l",1962,theory of the superfluidity of helium ii,1941,2043824501,,10.1103/PhysRev.60.356,WOS:000201560100013,0,0
Chemistry,20123,"seaborg, g",1951,radioactive element 94 from deuterons on uranium,1946,2005101692,,10.1103/PhysRev.69.366.2,WOS:A1946UB25900012,0,0
Physics,10148,"purcell, em",1952,resonance absorption by nuclear magnetic moments in a solid,1946,1983718136,,10.1103/PhysRev.69.37,WOS:A1946UB25600010,0,0
Physics,10147,"bloch, f",1952,the nuclear induction experiment,1946,1988204378,,10.1103/PhysRev.70.474,WOS:A1946UB26500004,0,0
Physics,10143,"lamb, we",1955,fine structure of the hydrogen atom by a microwave method,1947,2248814689,,10.1103/PhysRev.72.241,WOS:A1947UB28200011,0,0
Physics,10120,"schwinger, j",1965,on quantum electrodynamics and the magnetic moment of the electron,1948,2225565636,,10.1103/PhysRev.73.416,WOS:A1948UB29500027,0,0
Physics,10119,"feynman, rp",1965,relativistic cut off for quantum electrodynamics,1948,2142710655,,10.1103/PhysRev.74.1430,WOS:A1948UB77300021,0,0
Physics,10120,"schwinger, j",1965,quantum electrodynamics i a covariant formulation,1948,1973182975,,10.1103/PhysRev.74.1439,WOS:A1948UB77300022,0,0
Physics,10121,"tomonaga, si",1965,on infinite field reactions in quantum field theory,1948,2035127450,,10.1103/PhysRev.74.224,WOS:A1948UB76500025,0,0
Physics,10140,"brattain, wh",1956,the transistor a semi conductor triode,1948,2066255432,,10.1103/PhysRev.74.230,WOS:A1948UB76500033,0,0
Physics,10142,"kusch, p",1955,the magnetic moment of the electron,1948,2015930212,,10.1103/PhysRev.74.250,WOS:A1948UB76600004,0,0
Physics,10119,"feynman, rp",1965,a relativistic cut off for classical electrodynamics,1948,2015474809,,10.1103/PhysRev.74.939,WOS:A1948UB77100017,0,0
Physics,10125,"jensen, jhd",1963,on the magic numbers in nuclear structure,1949,1983767566,,10.1103/PhysRev.75.1766.2,WOS:A1949UB78600029,0,0
Physics,10126,"mayer, mg",1963,on closed shells in nuclei ii,1949,1985289694,,10.1103/PhysRev.75.1969,WOS:A1949UB78700055,0,0
Physics,10130,"hofstadter, r",1961,the detection of gamma rays with thallium activated sodium iodide crystals,1949,1991093461,,10.1103/PhysRev.75.796,WOS:A1949UB78000013,0,0
Physics,10119,"feynman, rp",1965,the theory of positrons,1949,1995841230,,10.1103/PhysRev.76.749,WOS:A1949UB32100009,0,0
Physics,10119,"feynman, rp",1965,space time approach to quantum electrodynamics,1949,2081796865,,10.1103/PhysRev.76.769,WOS:A1949UB32100114,0,0
Physics,10068,"ramsey, nf",1989,magnetic shielding of nuclei in molecules,1950,2012130053,,10.1103/PhysRev.78.699,WOS:A1950UB33900011,0,0
Physics,10103,"rainwater, j",1975,nuclear energy level argument for a spheroidal nuclear model,1950,2081328640,,10.1103/PhysRev.79.432,WOS:A1950UB34800003,0,0
Physics,10119,"feynman, rp",1965,mathematical formulation of the quantum theory of electromagnetic interaction,1950,1996620877,,10.1103/PhysRev.80.440,WOS:A1950UB34200026,0,0
Physics,10141,"shockley, w",1956,deformation potentials and mobilities in non polar crystals,1950,2067983335,,10.1103/PhysRev.80.72,WOS:A1950UB34000015,0,0
Physics,10082,"fowler, wa",1983,excited states of the mirror nuclei li7 and be7,1951,2075687768,,10.1103/PhysRev.82.159,WOS:A1951UB38300004,0,0
Physics,10059,"shull, cg",1994,neutron diffraction by paramagnetic and antiferromagnetic substances,1951,1970822797,,10.1103/PhysRev.83.333,WOS:A1951UB38900018,0,0
Physics,10131,"glaser, da",1960,some effects of ionizing radiation on the formation of bubbles in liquids,1952,2053131619,,10.1103/PhysRev.87.665,WOS:A1952UB43900026,0,0
Physics,10101,"bohr, a.",1975,interpretation of isomeric transitions of electric quadrupole type,1953,2086905158,,10.1103/PhysRev.89.316,WOS:A1953UB44800048,0,0
Physics,10101,"bohr, a.",1975,rotational states in even even nuclei,1953,2093806366,,10.1103/PhysRev.90.717.2,WOS:A1953UB45700052,0,0
Physics,10058,"reines, f",1995,detection of the free neutrino,1953,2246644974,,10.1103/PhysRev.92.830,WOS:A1953UB46800054,0,0
Physics,10084,"wilson, kg",1982,renormalization group and critical phenomena 1 renormalization group and the kadanoff scaling picture,1971,2246296081,,10.1103/PhysRevB.4.3174,WOS:A1971K734100043,0,0
Physics,10084,"wilson, kg",1982,renormalization group and critical phenomena 2 phase space cell analysis of critical behavior,1971,2079216472,,10.1103/PhysRevB.4.3184,WOS:A1971K734100044,0,0
Physics,10088,"cronin, jw",1980,evidence for the 2 pi decay of the k2 0 meson,1964,2078141585,,10.1103/PhysRevLett.13.138,WOS:A19641678C00001,0,0
Physics,10009,"englert, f",2013,broken symmetry and the mass of gauge vector mesons,1964,2045120204,,10.1103/PhysRevLett.13.321,WOS:A19641683C00003,0,0
Physics,10010,"higgs, pw",2013,broken symmetries and the masses of gauge bosons,1964,1996413343,,10.1103/PhysRevLett.13.508,WOS:A19641665C00004,0,0
Physics,10091,"weinberg, s",1979,a model of leptons,1967,2070151728,,10.1103/PhysRevLett.19.1264,WOS:A1967A179700017,0,0
Physics,10060,"brockhouse, bn",1994,lattice vibrations in silicon and germanium,1959,2014082198,,10.1103/PhysRevLett.2.256,WOS:A1959WL07600007,0,0
Physics,10039,raymond davis jr.,2002,search for neutrinos from the sun,1968,2023878063,,10.1103/PhysRevLett.20.1205,WOS:A1968B117500023,0,0
Physics,10065,"taylor, re",1990,electron proton elastic scattering at high momentum transfers,1968,2014867412,,10.1103/PhysRevLett.20.292,WOS:A1968A550400021,0,0
Physics,10065,"taylor, re",1990,high energy inelastic e p scattering at 6 degrees and 10 degrees,1969,1497196551,,10.1103/PhysRevLett.23.930,WOS:A1969E345000010,0,0
Physics,10065,"taylor, re",1990,observed behavior of highly inelastic electron proton scattering,1969,2026217372,,10.1103/PhysRevLett.23.935,WOS:A1969E345000011,0,0
Physics,10035,"leggett, aj",2003,can a solid be superfluid,1970,2072230004,,10.1103/PhysRevLett.25.1543,WOS:A1970H823900003,0,0
Physics,10054,"lee, dm",1996,evidence for a new phase of solid he 3,1972,1985120730,,10.1103/PhysRevLett.28.885,WOS:A1972M002000006,0,0
Physics,10035,"leggett, aj",2003,interpretation of recent results on sup 3 he below 3 mk a new liquid phase,1972,2078803329,,10.1103/PhysRevLett.29.1227,WOS:A1972N781800009,0,0
Physics,10054,"lee, dm",1996,new magnetic phenomena in liquidhe3below 3 mk,1972,2320840978,,10.1103/PhysRevLett.29.920,WOS:A1972N567000009,0,0
Physics,10031,"wilczek, f",2004,ultraviolet behavior of non abelian gauge theories,1973,2045472496,,10.1103/PhysRevLett.30.1343,WOS:A1973P914500020,0,0
Physics,10033,"politzer, hd",2004,reliable perturbative results for strong interactions,1973,2055032269,,10.1103/PhysRevLett.30.1346,WOS:A1973P914500021,0,0
Physics,10099,"ting, scc",1976,experimental observation of a heavy particle j,1974,2041374439,,10.1103/PhysRevLett.33.1404,WOS:A1974U764200012,0,0
Physics,10057,"perl, ml",1995,discovery of a narrow resonance in e e annihilation,1974,1985795857,,10.1103/PhysRevLett.33.1406,WOS:A1974U764200013,0,0
Physics,10057,"perl, ml",1995,the discovery of a second narrow resonance in e e annihilation,1974,2035537487,,10.1103/PhysRevLett.33.1453,WOS:A1974U864400013,0,0
Physics,10057,"perl, ml",1995,evidence for anomalous lepton production in e e annihilation,1975,2159227720,,10.1103/PhysRevLett.35.1489,WOS:A1975AX40700003,0,0
Chemistry,20041,"heeger, a",2000,electrical conductivity in doped polyacetylene,1977,1993209440,,10.1103/PhysRevLett.39.1098,WOS:A1977DY83900016,0,0
Physics,10021,"nambu, yoichiro",2008,axial vector current conservation in weak interactions,1960,2085522314,,10.1103/PhysRevLett.4.380,WOS:A1960WQ68000019,0,0
Physics,10079,"vonklitzing, k",1985,new method for high accuracy determination of the fine structure constant based on quantized hall resistance,1980,2061000251,,10.1103/PhysRevLett.45.494,WOS:A1980KC47000026,0,0
Physics,10048,"stormer, hl",1998,two dimensional magnetotransport in the extreme quantum limit,1982,2006294391,,10.1103/PhysRevLett.48.1559,WOS:A1982NR32700015,0,0
Physics,10107,"giaever, i",1973,energy gap in superconductors measured by electron tunneling,1960,2073782888,,10.1103/PhysRevLett.5.147,WOS:A1960WR34800007,0,0
Physics,10107,"giaever, i",1973,electron tunneling between two superconductors,1960,2002706548,,10.1103/PhysRevLett.5.464,WOS:A1960WR35400003,0,0
Physics,10003,"haldane, fdm",2016,nonlinear field theory of large spin heisenberg antiferromagnets semiclassically quantized solitons of the one dimensional easy axis neel state,1983,2113166233,,10.1103/PhysRevLett.50.1153,WOS:A1983QJ98500016,0,0
Physics,10050,"laughlin, rb",1998,anomalous quantum hall effect an incompressible quantum fluid with fractionally charged excitations,1983,1963826472,,10.1103/PhysRevLett.50.1395,WOS:A1983QM76700017,0,0
Chemistry,20015,"shechtman, d",2011,metallic phase with long range orientational order and no translational symmetry,1984,2569915238,,10.1103/PhysRevLett.53.1951,WOS:A1984TR73100024,0,0
Physics,10025,"grunberg, p",2007,layered magnetic structures evidence for antiferromagnetic coupling of fe layers across cr interlayers,1986,2024347200,,10.1103/PhysRevLett.57.2442,WOS:A1986E709300029,0,0
Physics,10037,"koshiba, m",2002,observation of a neutrino burst from the supernova sn1987a,1987,2068718327,,10.1103/PhysRevLett.58.1490,WOS:A1987G676000029,0,0
Physics,10051,"phillips, wd",1997,observation of atoms laser cooled below the doppler limit,1988,2082337324,,10.1103/PhysRevLett.61.169,WOS:A1988P108200010,0,0
Physics,10024,"fert, a",2007,giant magnetoresistance of 001 fe 001 cr magnetic superlattices,1988,1965245884,,10.1103/PhysRevLett.61.2472,WOS:A1988Q948900022,0,0
Physics,10052,"cohentannoudji, c",1997,laser cooling below the one photon recoil by velocity selective coherent population trapping,1988,2083763968,,10.1103/PhysRevLett.61.826,WOS:A1988P707100016,0,0
Physics,10116,"alvarez, lw",1968,evidence for a t 0 three pion resonance,1961,2034289567,,10.1103/PhysRevLett.7.178,WOS:A19611579C00013,0,0
Physics,10044,"alferov, zi",2000,ultranarrow luminescence lines from single quantum dots,1995,2071148840,,10.1103/PhysRevLett.74.4043,WOS:A1995QY11900035,0,0
Physics,10041,"ketterle, w",2001,bose einstein condensation in a gas of sodium atoms,1995,2132639490,,10.1103/PhysRevLett.75.3969,WOS:A1995TF68400001,0,0
Physics,10012,"wineland, david",2012,demonstration of a fundamental quantum logic gate,1995,1966533239,,10.1103/PhysRevLett.75.4714,WOS:A1995TK88300041,0,0
Physics,10012,"wineland, david",2012,generation of nonclassical motional states of a trapped atom,1996,2040136860,,10.1103/PhysRevLett.76.1796,WOS:A1996TZ28200009,0,0
Physics,10011,"haroche, serge",2012,quantum rabi oscillation a direct test of field quantization in a cavity,1996,2025623691,,10.1103/PhysRevLett.76.1800,WOS:A1996TZ28200010,0,0
Physics,10011,"haroche, serge",2012,observing the progressive decoherence of the meter in a quantum measurement,1996,2091261194,,10.1103/PhysRevLett.77.4887,WOS:A1996VW70700009,0,0
Physics,10004,"kajita, t",2015,evidence for oscillation of atmospheric neutrinos,1998,2134803267,,10.1103/PhysRevLett.81.1562,WOS:000075483200007,0,0
Physics,10029,"hall, jl",2005,direct link between microwave and optical frequencies with a 300 thz femtosecond laser comb,2000,2003141184,,10.1103/PhysRevLett.84.5102,WOS:000087266300018,0,0
Physics,10005,"mcdonald, ab",2015,measurement of the rate of ve d p p e interactions produced by 8b solar neutrinos at the sudbury neutrino observatory,2001,2137229134,,10.1103/PhysRevLett.87.071301,WOS:000170478300005,0,0
Physics,10005,"mcdonald, ab",2015,direct evidence for neutrino flavor transformation from neutral current interactions in the sudbury neutrino observatory,2002,1983987483,,10.1103/PhysRevLett.89.011301,WOS:000176285700003,0,0
Physics,10071,"steinberger, j",1988,observation of high energy neutrino reactions and the existence of two kinds of neutrinos,1962,2000744791,,10.1103/PhysRevLett.9.36,WOS:A19621596C00010,0,0
Physics,10038,"giacconi, r",2002,evidence for x rays from sources outside the solar system,1962,2029634216,,10.1103/PhysRevLett.9.439,WOS:A19621598C00007,0,0
Medicine,30131,"crick, fhc",1962,the packing of  helices simple coiled coils,1953,2116441099,,10.1107/S0365110X53001964,WOS:A1953UQ10400004,0,0
Chemistry,20073,"karle, j",1985,a theory of phase determination for the four types of non centrosymmetric space groups 1p222 2p22 3p12 3p22,1956,2011912423,,10.1107/S0365110X56001741,WOS:A1956WL85900004,0,0
Physics,10043,kroemer herbert ,2000,heterostructure bipolar transistors and integrated circuits,1982,2154249635,,10.1109/PROC.1982.12226,WOS:A1982NA92200003,0,0
Physics,10045,"kilby, js",2000,invention of the integrated circuit,1976,2015233893,,10.1109/T-ED.1976.18467,WOS:A1976BX59100006,0,0
Medicine,30116,"granit, r",1967,tonic and phasic ventral horn cells differentiated by post tetanic potentiation in cat extensors,1956,2016789585,,10.1111/j.1748-1716.1956.tb01347.x,WOS:A1956WP58100002,0,0
Medicine,30079,"bergstrom, s",1982,on the regulation of bile acid formation in the rat liver,1958,2043258254,,10.1111/j.1748-1716.1958.tb01572.x,WOS:A1958WP62100001,0,0
Medicine,30042,"carlsson, a",2000,a method for the fluorimetric determination of adrenaline and noradrenaline in tissues 1,1958,2055404553,,10.1111/j.1748-1716.1958.tb01627.x,WOS:A1958WP62700006,0,0
Medicine,30042,"carlsson, a",2000,a fluorimetric method for the determination of dopamine 3 hydroxytyramine,1958,2021432299,,10.1111/j.1748-1716.1958.tb01628.x,WOS:A1958WP62700007,0,0
Medicine,30079,"bergstrom, s",1982,observations on the effects of infusion of prostnglnndin e in man,1959,2019393655,,10.1111/j.1748-1716.1959.tb01686.x,WOS:A1959WP63400007,0,0
Medicine,30070,"levimontalcini, r",1986,effects of mouse tumor transplantation on the nervous system,1952,1965289808,,10.1111/j.1749-6632.1952.tb26548.x,WOS:A1952UG35900030,0,0
Medicine,30186,"hill, av",1922,a new mathematical treatment of changes of ionic concentration in muscle and nerve under the action of electric currents with a theory as to their mode of excitation,1910,1969031193,,10.1113/jphysiol.1910.sp001366,WOS:000201372000003,0,0
Medicine,30180,"hopkins, fg",1929,feeding experiments illustrating the importance of accessory factors in normal dietaries,1912,2059685491,,10.1113/jphysiol.1912.sp001524,WOS:000201343700005,0,0
Medicine,30187,"krogh, a",1920,the regulation of respiration and circulation during the initial stages of muscular work,1913,2079512683,,10.1113/jphysiol.1913.sp001616,WOS:000201344800009,0,0
Medicine,30187,"krogh, a",1920,the rate of diffusion of gases through animal tissues with some remarks on the coefficient of invasion,1919,1994652225,,10.1113/jphysiol.1919.sp001838,WOS:000201208300001,0,0
Medicine,30187,"krogh, a",1920,the number and distribution of capillaries in muscles with calculations of the oxygen pressure head necessary for supplying the tissue,1919,2109393326,,10.1113/jphysiol.1919.sp001839,WOS:000201208300002,0,0
Medicine,30187,"krogh, a",1920,the supply of oxygen to the tissues and the regulation of the capillary circulation,1919,2110457661,,10.1113/jphysiol.1919.sp001844,WOS:000201208300007,0,0
Medicine,30178,"adrian, ed",1932,the discharge of impulses in motor nerve fibres part i impulses in single fibres of the phrenic nerve,1928,2011803983,,10.1113/jphysiol.1928.sp002509,WOS:000207203300007,0,0
Medicine,30178,"adrian, ed",1932,the discharge of impulses in motor nerve fibres part ii the frequency of discharge in reflex and voluntary contractions,1929,2104904223,,10.1113/jphysiol.1929.sp002557,WOS:000207204100001,0,0
Medicine,30116,"granit, r",1967,the components of the retinal action potential in mammals and their relation to the discharge in the optic nerve,1933,2061401540,,10.1113/jphysiol.1933.sp002964,WOS:000201349000001,0,0
Medicine,30109,"katz, b",1970,the effect of sodium ions on the electrical activity of the giant axon of the squid,1949,2097400197,,10.1113/jphysiol.1949.sp004310,WOS:A1949UH78600006,0,0
Medicine,30109,"katz, b",1970,an analysis of the end plate potential recorded with an intra cellular electrode,1951,2117059432,,10.1113/jphysiol.1951.sp004675,WOS:A1951UH80600007,0,0
Medicine,30109,"katz, b",1970,spontaneous subthreshold activity at motor nerve endings,1952,2102492718,,10.1113/jphysiol.1952.sp004735,WOS:A1952UH81200008,0,0
Medicine,30126,"eccles, jc",1963,the recording of potentials from motoneurones with an intracellular electrode,1952,2098749676,,10.1113/jphysiol.1952.sp004759,WOS:A1952UH81500003,0,0
Medicine,30127,"hodgkin, al",1963,a quantitative description of membrane current and its application to conduction and excitation in nerve,1952,1985940938,,10.1113/jphysiol.1952.sp004764,WOS:A1952UH81500008,0,0
Medicine,30116,"granit, r",1967,supraspinal control of the muscle spindles and its significance,1953,2061183544,,10.1113/jphysiol.1953.sp005017,WOS:A1953UH83100005,0,0
Medicine,30109,"katz, b",1970,quantal components of the end plate potential,1954,2106081526,,10.1113/jphysiol.1954.sp005129,WOS:A1954UH83700012,0,0
Medicine,30126,"eccles, jc",1963,cholinergic and inhibitory synapses in a pathway from motor axon collaterals to motoneurones,1954,2073929966,,10.1113/jphysiol.1954.sp005226,WOS:A1954UH84300008,0,0
Medicine,30116,"granit, r",1967,excitatory and inhibitory processes acting upon individual purkinje cells of the cerebellum in cats,1956,2047758880,,10.1113/jphysiol.1956.sp005606,WOS:A1956WB69500004,0,0
Medicine,30109,"katz, b",1970,a study of the desensitization produced by acetylcholine at the motor end plate,1957,2009285843,,10.1113/jphysiol.1957.sp005838,WOS:A1957WC30800059,0,0
Medicine,30080,"hubel, dh",1981,receptive fields binocular interaction and functional architecture in the cat s visual cortex,1962,2116360511,,10.1113/jphysiol.1962.sp006837,WOS:A19626729B00007,0,0
Medicine,30080,"hubel, dh",1981,receptive fields and functional architecture of monkey striate cortex,1968,2117731089,,10.1113/jphysiol.1968.sp008455,WOS:A1968A792100014,0,0
Medicine,30132,"vonbekesy, g",1961,the variation of phase along the basilar membrane with sinusoidal vibrations,1947,1987303129,,10.1121/1.1916502,WOS:A1947UD57500008,0,0
Medicine,30144,"robbins, fc",1954,cultivation of the lansing strain of poliomyelitis virus in cultures of various human embryonic tissues,1949,2010653647,,10.1126/science.109.2822.85,WOS:A1949UA78500005,0,0
Chemistry,20112,"libby, w",1960,age determination by radiocarbon content world wide assay of natural radiocarbon,1949,2013668561,,10.1126/science.109.2827.227,WOS:A1949UA79000002,0,0
Physics,10016,"novoselov, kostya s.",2010,electric field effect in atomically thin carbon films,2004,2058122340,,10.1126/science.1102896,WOS:000224756700045,0,0
Medicine,30118,"wald, g",1967,cistrans isomers of vitamin a and retinene in vision,1952,2066637830,,10.1126/science.115.2977.60,WOS:A1952UA99300004,0,0
Medicine,30108,"axelrod, j",1970,o methylation of epinephrine and other catechols in vitro and in vivo,1957,2036416641,,10.1126/science.126.3270.400,WOS:A1957ZQ26200007,0,0
Medicine,30115,"holley, rw",1968,Structure of a Ribonucleic Acid,1965,2024412145,,10.1126/science.147.3664.1462,WOS:A19656257100035,0,0
Medicine,30008,"sudhof, tc",2013,synaptotagmin a calcium sensor on the synaptic vesicle surface,1992,1976283234,,10.1126/science.1589771,WOS:A1992HU22400039,0,0
Medicine,30040,"kandel, er",2000,neuronal correlates of habituation and dishabituation of the gill withdrawal reflex in aplysia,1970,2149101054,,10.1126/science.167.3926.1743,WOS:A1970F772600037,0,0
Chemistry,20026,"kornberg, r",2006,chromatin structure a repeating unit of histones and dna,1974,2013571070,,10.1126/science.184.4139.868,WOS:A1974S947500011,0,0
