field,laureate_id,laureate_name,prize_year,title,pub_year,paper_id,additional_info,doi,uid,nonenglish,no_record
Chemistry,20017,"negishi, e",2010,novel stereoselective alkenyl aryl coupling via nickel catalysed reaction of alkenylanes with aryl halides,1976,2112011781,,10.1039/C3976000596B,WOS:A1976CA46000019,0,0
Chemistry,20041,"heeger, a",2000,synthesis of electrically conducting organic polymers halogen derivatives of polyacetylene ch x,1977,1999332606,,10.1039/C39770000578,WOS:A1977DS45700024,0,0
Chemistry,20163,"rutherford, e",1908,lxxxiv the radioactivity of thorium compounds ii the cause and nature of radioactivity,1902,2035526860,,10.1039/CT9028100837,WOS:000188172500002,0,0
Chemistry,20157,"soddy, f",1921,cxxxii the atomic weight of lead from ceylon thorite,1914,2028328651,,10.1039/CT9140501402,WOS:000188274600134,0,0
Chemistry,20129,"robinson, r",1947,lxxv a theory of the mechanism of the phytochemical synthesis of certain alkaloids,1917,2022144691,,10.1039/CT9171100876,WOS:000188142500075,0,0
Chemistry,20139,"haworth, w",1937,lxxxiii polysaccharides part i the structure of inulin,1928,2031570059,,10.1039/JR9280000619,WOS:000188152600083,0,0
Chemistry,20116,"hinshelwood, c",1956,227 on the factors determining the velocity of reactions in solution molecular statistics of the benzoylation of amines,1934,1988560669,,10.1039/JR9340001079,WOS:000188153900036,0,0
Chemistry,20116,"hinshelwood, c",1956,333 the activation energy of organic reactions part iv transmission of substituent influences in ester hydrolysis,1938,2070976790,,10.1039/JR9380001801,WOS:000188154400163,0,0
Chemistry,20115,"todd, a",1957,studies on phosphorylation .1. dibenzyl chlorophosphonate as a phosphorylating agent,1945,1964933902,,10.1039/JR9450000382,WOS:A1945UB71900032,0,0
Chemistry,20115,"todd, a",1957,studies on phosphorylation .2. the reaction of dialkyl phosphites with polyhalogen compounds in presence of bases - a new method for the phosphorylation of amines,1945,2007487132,,10.1039/JR9450000660,WOS:A1945UB72100005,0,0
Chemistry,20098,"barton, d",1969,the principles of conformational analysis,1956,2014815386,,10.1039/QR9561000044,WOS:A1956WX78800003,0,0
Chemistry,20113,"heyrovsky, j",1959,the processes at the mercury dropping cathode part i the deposition of metals,1924,2160441152,,10.1039/TF9241900692,WOS:000202761700002,0,0
Chemistry,20128,"tiselius, a",1948,a new apparatus for electrophoretic analysis of colloidal mixtures,1937,2094419713,,10.1039/TF9373300524,WOS:000202778300066,0,0
Medicine,30186,"hill, av",1922,the combinations of haemoglobin with oxygen and with carbon monoxide i,1913,2242726375,,10.1042/bj0070471,WOS:000187141700005,0,0
Chemistry,20135,"hevesy, g",1943,the absorption and translocation of lead by plants a contribution to the application of the method of radioactive indicators in the investigation of the change of substance in plants,1923,1493302394,,10.1042/bj0170439,WOS:000187168500001,0,0
Medicine,30167,"dam, h",1943,the antihaemorrhagic vitamin of the chick,1935,207049882,,10.1042/bj0291273,WOS:000187171700154,0,0
Medicine,30148,"krebs, ha",1953,metabolism of ketonic acids in animal tissues,1937,1802786708,,10.1042/bj0310645,WOS:000187171900087,0,0
Chemistry,20128,"tiselius, a",1948,electrophoresis of serum globulin electrophoretic analysis of normal and immune sera,1937,1462038810,,10.1042/bj0311464,WOS:000187172000033,0,0
Chemistry,20114,"sanger, f",1958,the free amino groups of insulin,1945,1918431092,,10.1042/bj0390507,WOS:A1945UB91100024,0,0
Medicine,30099,"duve, cd",1974,tissue fractionation studies 4 comparative study of the binding of acid phosphatase  glucuronidase and cathepsin by rat liver particles,1955,2415205045,,10.1042/bj0590433,WOS:A1955WA22400024,0,0
Medicine,30099,"duve, cd",1974,tissue fractionation studies 5 the association of acid phosphatase with a special class of cytoplasmic granules in rat liver,1955,170240114,,10.1042/bj0590438,WOS:A1955WA22400025,0,0
Chemistry,20114,"sanger, f",1958,disulphide interchange reactions,1955,69257807,,10.1042/bj0600535,WOS:A1955WA22600084,0,0
Chemistry,20114,"sanger, f",1958,the disulphide bonds of insulin,1955,2414829511,,10.1042/bj0600541,WOS:A1955WA22600085,0,0
Medicine,30099,"duve, cd",1974,tissue fractionation studies 6 intracellular distribution patterns of enzymes in rat liver tissue,1955,1205458192,,10.1042/bj0600604,WOS:A1955WA22600093,0,0
Medicine,30105,"porter, rr",1972,the hydrolysis of rabbit  globulin and antibodies with crystalline papain,1959,1786523947,,10.1042/bj0730119,WOS:A1959WA25700020,0,0
Physics,10044,"alferov, zi",2000,low threshold large to injection laser emission from inga as quantum dots,1994,2078503440,,10.1049/el:19940939,WOS:A1994PG48100042,0,0
Physics,10018,"kao, kc",2009,dielectric fibre surface waveguides for optical frequencies,1966,2159795626,,10.1049/piee.1966.0189,WOS:A19667972900004,0,0
Physics,10113,"neel, l",1970,proprietes magnetiques des ferrites ferrimagnetisme et antiferromagnetisme,1948,2608873142,,10.1051/anphys/194812030137,,1,0
Chemistry,20143,"curie, i",1935,. Production artificielle d'lments radioactifs - II. Preuve chimique de la transmutation des lments,1934,2090325778,,10.1051/jphysrad:0193400504015300,,1,0
Medicine,30168,"domagk, g",1939,ein beitrag zur chemotherapie der bakteriellen infektionen,1935,1964719327,,10.1055/s-0028-1129486,,1,0
Medicine,30168,"domagk, g",1939,eine neue klasse von desinfektionsmitteln--A new class of disinfectant,1935,2039414773,,10.1055/s-0028-1129654,WOS:000202262700217,0,0
Physics,10008,"nakamura, shuji",2014,candela class high brightness ingan algan double heterostructure blue light emitting diodes,1994,2054227182,,10.1063/1.111832,WOS:A1994ND58300031,0,0
Chemistry,20070,"polanyi, j",1986,location of energy barriers i effect on the dynamics of reactions a bc,1969,1966701000,,10.1063/1.1672194,WOS:A1969E178700025,0,0
Chemistry,20071,herschba.dr,1986,combination rules for van der waals force constants,1970,2093135107,,10.1063/1.1674404,WOS:A1970H413800037,0,0
Chemistry,20072,"lee, y",1986,intermolecular potentials from crossed beam differential elastic scattering measurements iv ar ar,1972,2010311338,,10.1063/1.1677399,WOS:A1972L580300017,0,0
Chemistry,20072,"lee, y",1986,crossed molecular beam study of f c2h4 c2d4,1972,1521493173,,10.1063/1.1677917,WOS:A1972M345200065,0,0
Chemistry,20025,"ertl, g",2007,adsorption of hydrogen on nickel single crystal surfaces,1974,2048353665,,10.1063/1.1680935,WOS:A1974T286300060,0,0
Physics,10064,"degennes, pg",1991,coil stretch transition of dilute flexible polymers under ultrahigh velocity gradients,1974,2148849027,,10.1063/1.1681018,WOS:A1974T585800058,0,0
Chemistry,20071,herschba.dr,1986,molecular beam reactive scattering apparatus with electron bombardment detector,1969,2038263790,,10.1063/1.1683809,WOS:A1969E556900007,0,0
Chemistry,20078,"fukui, k",1981,a molecular orbital theory of reactivity in aromatic hydrocarbons,1952,2077796804,,10.1063/1.1700523,WOS:A1952UC09800036,0,0
Medicine,30087,"cormack, am",1979,representation of a function by its line integrals with some radiological applications,1963,2004804713,,10.1063/1.1713127,WOS:A19643794B00046,0,0
Chemistry,20060,"ernst, r",1991,application of fourier transform spectroscopy to magnetic resonance,1966,2070302549,,10.1063/1.1719961,WOS:A19667229300021,0,0
Chemistry,20087,"lipscomb, w",1976,theory of polyhedral molecules iii population analyses and reactivities for the carboranes,1962,2080629537,,10.1063/1.1732484,WOS:A19624127B00028,0,0
Chemistry,20087,"lipscomb, w",1976,theory of polyhedral molecules i physical factorizations of the secular equation,1962,1982596993,,10.1063/1.1732849,WOS:A19624134B00024,0,0
Chemistry,20087,"lipscomb, w",1976,boron hydrides lcao mo and resonance studies,1962,2028808912,,10.1063/1.1733113,WOS:A19624139B00018,0,0
Chemistry,20079,"hoffmann, r",1981,an extended huckel theory i hydrocarbons,1963,1981458170,,10.1063/1.1734456,WOS:A19634168B00014,0,0
Physics,10107,"giaever, i",1973,tunneling through thin insulating layers,1961,2001716999,,10.1063/1.1735973,WOS:A19613758B00009,0,0
Chemistry,20104,"mulliken, r",1966,electronic population analysis on lcao mo molecular wave functions i,1955,1650728208,,10.1063/1.1740588,WOS:A1955WW65500016,0,0
Chemistry,20059,"marcus, r",1992,on the theory of oxidation reduction reactions involving electron transfer i,1956,2001270915,,10.1063/1.1742723,WOS:A1956WA67400007,0,0
Chemistry,20060,"ernst, r",1991,two dimensional spectroscopy application to nuclear magnetic resonance,1976,2010528272,,10.1063/1.432450,WOS:A1976BG78500052,0,0
Chemistry,20025,"ertl, g",2007,a molecular beam investigation of the catalytic oxidation of co on pd 111,1978,2008893762,,10.1063/1.436666,WOS:A1978FN93500047,0,0
Chemistry,20060,"ernst, r",1991,investigation of exchange processes by two dimensional nmr spectroscopy,1979,2074770586,,10.1063/1.438208,WOS:A1979HW09500041,0,0
Chemistry,20044,"zewail, a",1999,femtosecond real time observation of wave packet oscillations resonance in dissociation reactions,1988,2003771289,,10.1063/1.454408,WOS:A1988N555800073,0,0
Medicine,30160,"muller, hj",1946,the production of mutations by x rays,1928,2034764451,,10.1073/pnas.14.9.714,WOS:000201970400151,0,0
Medicine,30138,"beadle, gw",1958,genetic control of biochemical reactions in neurospora,1941,1982444105,,10.1073/pnas.27.11.499,WOS:000201971700108,0,0
Medicine,30076,"mcclintock, b",1983,the fusion of broken ends of chromosomes following nuclear fusion,1942,2027884659,,10.1073/pnas.28.11.458,WOS:000201971800095,0,0
Medicine,30076,"mcclintock, b",1983,the origin and behavior of mutable loci in maize,1950,2026519705,,10.1073/pnas.36.6.344,WOS:A1950XZ91900002,0,0
Chemistry,20119,"pauling, l",1954,the structure of proteins two hydrogen bonded helical configurations of the polypeptide chain,1951,2140992384,,10.1073/pnas.37.4.205,WOS:A1951XZ92900004,0,0
Medicine,30069,"cohen, s",1986,a nerve growth stimulating factor isolated from sarcom as 37 and 180,1954,2040742427,,10.1073/pnas.40.10.1014,WOS:A1954XZ97100026,0,0
Medicine,30075,"jerne, nk",1984,the natural selection theory of antibody formation,1955,2064008537,,10.1073/pnas.41.11.849,WOS:A1955WU96200008,0,0
Medicine,30069,"cohen, s",1986,a nerve growth stimulating factor isolated from snake venom,1956,2103276585,,10.1073/pnas.42.9.571,WOS:A1956WL58700001,0,0
Medicine,30113,"nirenberg, m",1968,the dependence of cell free protein synthesis in e coli upon naturally occurring or synthetic polyribonucleotides,1961,2060528969,,10.1073/pnas.47.10.1588,WOS:A19619792B00014,0,0
Chemistry,20093,"anfinsen, c",1972,the kinetics of formation of native ribonuclease during oxidation of the reduced polypeptide chain,1961,1991498388,,10.1073/pnas.47.9.1309,WOS:A19619801B00001,0,0
Medicine,30081,"sperry, rw",1981,chemoaffinity in the orderly growth of nerve fiber patterns and connections,1963,1980094138,,10.1073/pnas.50.4.703,WOS:A19639823B00029,0,0
Medicine,30041,greengar.p,2000,cyclic nucleotide dependent protein kinases iv widespread occurrence of adenosine 3 5 monophosphate dependent protein kinase in various tissues and phyla of the animal kingdom,1969,2013216313,,10.1073/pnas.64.4.1349,WOS:A1969F268900032,0,0
Medicine,30088,"nathans, d",1978,specific cleavage of simian virus 40 dna by restriction endonuclease of hemophilus influenzae,1971,2090526981,,10.1073/pnas.68.12.2913,WOS:A1971L129000003,0,0
Medicine,30071,"brown, ms",1985,regulation of 3 hydroxy 3 methylglutaryl coenzyme a reductase activity in human fibroblasts by lipoproteins,1973,2021537613,,10.1073/pnas.70.7.2162,WOS:A1973Q221400059,0,0
Medicine,30077,samuelss.b,1982,isolation and structure of two prostaglandin endoperoxides that cause platelet aggregation,1974,2010694924,,10.1073/pnas.71.2.345,WOS:A1974S385200025,0,0
Medicine,30077,samuelss.b,1982,prostaglandin endoperoxides novel transformations of arachidonic acid in human platelets,1974,2050568232,,10.1073/pnas.71.9.3400,WOS:A1974U397600019,0,0
Chemistry,20005,"lindahl, t",2015,an n glycosidase from escherichia coli that releases free uracil from dna containing deaminated cytosine residues,1974,2016134181,,10.1073/pnas.71.9.3649,WOS:A1974U397600072,0,0
Medicine,30077,samuelss.b,1982,thromboxanes a new group of biologically active compounds derived from prostaglandin endoperoxides,1975,2030087792,,10.1073/pnas.72.8.2994,WOS:A1975AS84000035,0,0
Medicine,30068,"tonegawa, s",1987,evidence for somatic rearrangement of immunoglobulin genes coding for variable and constant regions,1976,1982039072,,10.1073/pnas.73.10.3628,WOS:A1976CH08400066,0,0
Chemistry,20081,"sanger, f",1980,dna sequencing with chain terminating inhibitors,1977,2138270253,,10.1073/pnas.74.12.5463,WOS:A1977EH42100059,0,0
Chemistry,20080,"gilbert, w",1980,a new method for sequencing dna,1977,1992595091,,10.1073/pnas.74.2.560,WOS:A1977CW79100038,0,0
Medicine,30044,"murad, f",1998,nitric oxide activates guanylate cyclase and increases guanosine 3 5 cyclic monophosphate levels in various tissue preparations,1977,2000075945,,10.1073/pnas.74.8.3203,WOS:A1977DT27000023,0,0
Medicine,30009,"schekman, r",2013,secretion and cell surface growth are blocked in a temperature sensitive mutant of saccharomyces cerevisiae,1979,1966446749,,10.1073/pnas.76.4.1858,WOS:A1979GS38600072,0,0
Medicine,30077,samuelss.b,1982,arachidonic acid metabolism in polymorphonuclear leukocytes effects of ionophore a23187,1979,2059290365,,10.1073/pnas.76.5.2148,WOS:A1979GW30700014,0,0
Medicine,30077,samuelss.b,1982,leukotriene c a slow reacting substance from murine mastocytoma cells,1979,2123773797,,10.1073/pnas.76.9.4275,WOS:A1979HM88600028,0,0
Medicine,30054,"gilman, ag",1994,purification of the regulatory component of adenylate cyclase,1980,1984080990,,10.1073/pnas.77.11.6516,WOS:A1980KT32200044,0,0
Chemistry,20030,"ciechanover, a",2004,atp dependent conjugation of reticulocyte proteins with the polypeptide required for protein degradation,1980,2034941135,,10.1073/pnas.77.3.1365,WOS:A1980JL81400024,0,0
Chemistry,20030,"ciechanover, a",2004,proposed role of atp in protein breakdown conjugation of protein with multiple chains of the polypeptide of atp dependent proteolysis,1980,1968229731,,10.1073/pnas.77.4.1783,WOS:A1980JP73600005,0,0
Medicine,30046,"ignarro, lj",1998,endothelium derived relaxing factor produced and released from artery and vein is nitric oxide,1987,2092145002,,10.1073/pnas.84.24.9265,WOS:A1987L760100107,0,0
Chemistry,20023,"tsien, r",2008,wavelength mutations and posttranslational autoxidation of green fluorescent protein,1994,2036742051,,10.1073/pnas.91.26.12501,WOS:A1994PY29400031,0,0
Physics,10179,"bohr, n",1922,ii on the theory of the decrease of velocity of moving electrified particles on passing through matter,1913,2263196060,,10.1080/14786440108634305,WOS:000208075100002,0,0
Physics,10178,"millikan, ra",1923,a new modification of the cloud method of measuring the elementary electrical charge and the most probable value of that charge,1910,2063658535,,10.1080/14786440208636795,WOS:000202851700023,0,0
Physics,10179,"bohr, n",1922,i on the constitution of atoms and molecules,1913,1703910647,,10.1080/14786441308634955,WOS:000208075900001,0,0
Physics,10179,"bohr, n",1922,xxxvii on the constitution of atoms and molecules,2009,1805515744,,10.1080/14786441308634993,WOS:000208076100009,0,0
Physics,10179,"bohr, n",1922,lxxiii on the constitution of atoms and molecules,1913,2060222759,,10.1080/14786441308635031,WOS:000208076400005,0,0
Physics,10172,"compton, ah",1927,cxvii the total reflexion of x rays,1923,2051374510,,10.1080/14786442308634208,WOS:000200027900003,0,0
Physics,10170,"broglie, ld",1929,xxxv a tentative theory of light quanta,1924,2107020988,,10.1080/14786442408634378,WOS:000200028700013,0,0
Physics,10191,joseph john thomson,1906,XL. Cathode Rays,1897,2050833490,,10.1080/14786449708621070,,0,1
Medicine,30100,"palade, ge",1974,a small particulate component of the cytoplasm,1955,2080669995,,10.1083/jcb.1.1.59,WOS:A1955WD76500006,0,0
Medicine,30100,"palade, ge",1974,the fine structure of neurons,1955,2106858079,,10.1083/jcb.1.1.69,WOS:A1955WD76500007,0,0
Medicine,30001,"ohsumi, y",2016,autophagy in yeast demonstrated with proteinase deficient mutants and conditions for its induction,1992,2126801593,,10.1083/jcb.119.2.301,WOS:A1992JT98100005,0,0
Medicine,30043,"blobel, g",1999,transfer of proteins across membranes i presence of proteolytically processed and unprocessed nascent immunoglobulin light chains on membrane bound ribosomes of murine myeloma,1975,2146923243,,10.1083/jcb.67.3.835,WOS:A1975AY44900025,0,0
Medicine,30085,benacerr.b,1980,properties of guinea pig 7s antibodies i electrophoretic separation of two types of guinea pig 7s antibodies,1963,2094124809,,10.1084/jem.117.6.937,WOS:A19634836B00004,0,0
Medicine,30085,benacerr.b,1980,properties of guinea pig 7s antibodies ii identification of antibodies involved in passive cutaneous and systemic anaphylaxis,1963,2169383488,,10.1084/jem.117.6.951,WOS:A19634836B00014,0,0
Medicine,30120,"rous, p",1966,a transmissible avian neoplasm sarcoma of the common fowl,1910,2012383467,,10.1084/jem.12.5.696,WOS:000201744900011,0,0
Medicine,30085,benacerr.b,1980,properties of antibodies cytophilic for macrophages,1966,2086695584,,10.1084/jem.123.1.119,WOS:A19667183900008,0,0
Medicine,30120,"rous, p",1966,a sarcoma of the fowl transmissible by an agent separable from the tumor cells,1911,2050973237,,10.1084/jem.13.4.397,WOS:000201745400001,0,0
Medicine,30013,"steinman, rm",2011,identification of a novel cell type in peripheral lymphoid organs of mice i morphology quantitation tissue distribution,1973,2145049340,,10.1084/jem.137.5.1142,WOS:A1973P573400003,0,0
Medicine,30150,"theiler, m",1951,spontaneous encephalomyelitis of mice a new virus disease,1937,2013142695,,10.1084/jem.65.5.705,WOS:000202271800008,0,0
Chemistry,20128,"tiselius, a",1948,an electrophoretic study of immune sera and purified antibody preparations,1939,2046577012,,10.1084/jem.69.1.119,WOS:000202273800008,0,0
Medicine,30101,"claude, a",1974,a study of tissue culture cells by electron microscopy methods and preliminary observations,1945,2162734772,,10.1084/jem.81.3.233,WOS:A1945UD28000001,0,0
Medicine,30101,"claude, a",1974,fractionation of mammalian liver cells by differential centrifugation i problems methods and preparation of extract,1946,2144434797,,10.1084/jem.84.1.51,WOS:A1946UD29600006,0,0
Medicine,30101,"claude, a",1974,fractionation of mammalian liver cells by differential centrifugation ii experimental procedures and results,1946,2090488193,,10.1084/jem.84.1.61,WOS:A1946UD29600007,0,0
Medicine,30098,"dulbecco, r",1975,plaque formation and isolation of pure lines with poliomyelitis viruses,1954,2046171723,,10.1084/jem.99.2.167,WOS:A1954UD38800006,0,0
Chemistry,20131,"northrop, j",1946,a method for the determination of diffusion constants and the calculation of the radius and weight of the hemoglobin molecule,1929,2013282061,,10.1085/jgp.12.4.543,WOS:000202002400005,0,0
Medicine,30111,"hershey, ad",1969,independent functions of viral protein and nucleic acid in growth of bacteriophage,1952,1988037647,,10.1085/jgp.36.1.39,WOS:A1952UD54300004,0,0
Medicine,30118,"wald, g",1967,cis trans isomers of vitamin a and retinene in the rhodopsin system,1952,2037138473,,10.1085/jgp.36.2.269,WOS:A1952UD54400011,0,0
Medicine,30118,"wald, g",1967,the molar extinction of rhodopsin,1953,2105756791,,10.1085/jgp.37.2.189,WOS:A1953UD55000004,0,0
Physics,10083,"chandrasekhar, s",1983,the maximum mass of ideal white dwarfs,1931,2606047231,,10.1086/143324,WOS:000188069000005,0,0
Chemistry,20096,"herzberg, g.",1971,analysis of the 4050 a group of the c 3 molecule,1965,2031237286,,10.1086/148262,WOS:A19656693500005,0,0
Physics,10094,"wilson, rw",1978,a measurement of excess antenna temperature at 4080 mc s,1965,1997756830,,10.1086/148307,WOS:A19656693500048,0,0
Physics,10027,"smoot, gf",2006,cobe differential microwave radiometers preliminary systematic error analysis,1992,1986563620,,10.1086/172033,WOS:A1992KB24300001,0,0
Physics,10061,"hulse, ra",1993,discovery of a pulsar in a binary system,1975,2019709661,,10.1086/181708,WOS:A1975V424000001,0,0
Physics,10026,"mather, jc",2006,a preliminary measurement of the cosmic microwave background spectrum by the cosmic background explorer cobe satellite,1990,2079724444,,10.1086/185717,WOS:A1990DC92800001,0,0
Physics,10014,"schmidt, bp",2011,observational evidence from supernovae for an accelerating universe and a cosmological constant,1998,2073832139,,10.1086/300499,WOS:000076040700001,0,0
Medicine,30032,"mansfield, p",2003,multi planar image formation using nmr spin echoes,1977,2065113098,,10.1088/0022-3719/10/3/004,WOS:A1977CZ86000004,0,0
Physics,10001,"thouless, dj",2016,ordering metastability and phase transitions in two dimensional systems,1973,2086860422,,10.1088/0022-3719/6/7/010,WOS:A1973P474500010,0,0
Physics,10096,"mott, n",1977,the basis of the electron theory of metals with special reference to the transition metals,1949,1972068641,,10.1088/0370-1298/62/7/303,WOS:A1949YE41100003,0,0
Physics,10181,charles edouard guillaume,1920,The Anomaly of the Nickel-Steels,1919,2056303910,,10.1088/1478-7814/32/1/337,,0,1
Medicine,30116,"granit, r",1967,fibre interaction in injured or compressed region of nerve,1944,2026324210,,10.1093/brain/67.2.125,WOS:000201327900009,0,0
Chemistry,20111,"calvin, m",1961,the path of carbon in photosynthesis vii respiration and photosynthesis,1950,1990139631,,10.1093/jxb/1.1.63,WOS:A1950YF61700004,0,0
Physics,10146,"zernike, f",1953,diffraction theory of the knife edge test and its improved form the phase contrast method,1934,2031478061,,10.1093/mnras/94.5.377,,0,1
Chemistry,20057,"smith, m",1993,oligonucleotide directed mutagenesis using m13 derived vectors an efficient and general procedure for the production of point mutations in any fragment of dna,1982,2084884863,,10.1093/nar/10.20.6487,WOS:A1982PN41700028,0,0
Medicine,30025,"smithies, o",2007,a comprehensive set of sequence analysis programs for the vax,1984,2009310436,,10.1093/nar/12.1Part1.387,WOS:A1984SA44700035,0,0
Medicine,30189,"carrel, a",1912,results of the biterminal transplantation of veins,1906,2067983941,,10.1097/00000441-190609000-00006,WOS:000202637200032,0,0
Medicine,30189,"carrel, a",1912,viii on the experimental surgery of the thoracic aorta and heart,1910,142463470,,10.1097/00000658-191007000-00009,WOS:000201629600008,0,0
Medicine,30141,"richards, dw",1956,pulmonary in sufficiency i physiological classification clinical methods of analysis standard values in normal subjects,1948,2156375589,,10.1097/00005792-194809000-00001,WOS:A1948UZ39400001,0,0
Physics,10184,"barkla, cg",1917,polarisation in secondary rontgen radiation,1906,2087929793,,10.1098/rspa.1906.0021,WOS:000202828500005,0,0
Physics,10173,"wilson, ctr",1927,on a method of making visible the paths of ionising particles through a gas,1911,1990379124,,10.1098/rspa.1911.0041,WOS:000202796100008,0,0
Physics,10185,"bragg, wl",1915,the reflection of x rays by crystals,1913,1986715836,,10.1098/rspa.1913.0040,WOS:000202797100001,0,0
Physics,10185,"bragg, wl",1915,the structure of some crystals as indicated by their diffraction of x rays,1913,2149044878,,10.1098/rspa.1913.0083,WOS:000202807000003,0,0
Physics,10154,"appleton, ev",1947,on some direct evidence for downward atmospheric reflection of electric rays,1925,2157392200,,10.1098/rspa.1925.0149,WOS:000202789300005,0,0
Physics,10167,"dirac, pam",1933,the quantum theory of the electron,1928,2127865535,,10.1098/rspa.1928.0023,WOS:000202787400007,0,0
Chemistry,20116,"hinshelwood, c",1956,further investigations on the kinetics of gaseous oxidation reactions,1930,2040558105,,10.1098/rspa.1930.0156,WOS:000202791300004,0,0
Physics,10153,"blackett, pms",1948,further investigations with a wilson chamber ii the range and velocity of recoil atoms,1932,1968872513,,10.1098/rspa.1932.0013,WOS:000202773300010,0,0
Physics,10149,"walton, ets",1951,experiments with high velocity positive ions ii the disintegration of elements by high velocity protons,1932,2062734533,,10.1098/rspa.1932.0133,WOS:000202774500016,0,0
Physics,10153,"blackett, pms",1948,some photographs of the tracks of penetrating radiation,1933,2161454420,,10.1098/rspa.1933.0048,WOS:000202774400017,0,0
Physics,10112,"gabor, d",1971,microscopy by reconstructed wave fronts,1949,2067287942,,10.1098/rspa.1949.0075,WOS:A1949XZ66800002,0,0
Chemistry,20096,"herzberg, g.",1971,the bakerian lecture the spectra and structures of free methyl and free methylene,1961,1982976316,,10.1098/rspa.1961.0120,WOS:A19619947B00013,0,0
Chemistry,20096,"herzberg, g.",1971,the spectrum and structure of singlet ch 2,1966,2143085463,,10.1098/rspa.1966.0229,WOS:A19668632700002,0,0
Chemistry,20149,"harden, a",1929,the alcoholic ferment of yeast juice,1906,1976820754,,10.1098/rspb.1906.0029,WOS:000200339800005,0,0
Medicine,30076,"mcclintock, b",1983,chromosome organization and genic expression,1951,2130578722,,10.1101/SQB.1951.016.01.004,WOS:A1951UC66100002,0,0
Medicine,30117,"hartline, hk",1967,the peripheral origin of nervous activity in the visual system,1952,2152164341,,10.1101/SQB.1952.017.01.013,WOS:A1952UC66200011,0,0
Medicine,30130,"watson, jd",1962,the structure of dna,1953,2127674396,,10.1101/SQB.1953.018.01.020,WOS:A1953UC66300019,0,0
Medicine,30123,"jacob, f",1965,on the regulation of gene activity,1961,2100416355,,10.1101/SQB.1961.026.01.024,WOS:A19619006A00016,0,0
Medicine,30123,"jacob, f",1965,general conclusions teleonomic mechanisms in cellular metabolism growth and differentiation,1961,2327883350,,10.1101/SQB.1961.026.01.048,WOS:A19619006A00023,0,0
Chemistry,20077,"klug, a",1982,physical principles in the construction of regular viruses,1962,2078507839,,10.1101/SQB.1962.027.001.005,WOS:A19629007A00007,0,0
Physics,10123,"townes, ch",1964,stark effect in rapidly varying fields,1955,2080559570,,10.1103/PhysRev.100.703,WOS:A1955WB70900045,0,0
