field,laureate_id,laureate_name,prize_year,title,pub_year,paper_id,additional_info,doi,uid,nonenglish,no_record
Medicine,30174,"minot, gr",1934,treatment of pernicious anemia by a special diet,1926,2032615709,,10.1001/jama.1926.02680070016005,WOS:000201650200060,0,0
Medicine,30174,"minot, gr",1934,a diet rich in liver in the treatment of pernicious anemia study of one hundred and five cases,1927,2034899879,,10.1001/jama.1927.02690100021007,WOS:000201650300139,0,0
Medicine,30095,"blumberg, bs",1976,a new antigen in leukemia sera,1965,2082505865,,10.1001/jama.1965.03080070025007,WOS:A19656141500006,0,0
Medicine,30189,"carrel, a",1912,results of the transplantation of blood vessels organs and limbs,1908,2052889597,,10.1001/jama.1983.03340070050029,WOS:000201809200235,0,0
Physics,10192,"lenard, p",1905,Ueber Kathodenstrahlen in Gasen von atmosphrischem Druck und im ussersten Vacuum,1894,2150938918,,10.1002/andp.18942870202,,1,0
Physics,10183,"planck, m",1918,Ueber das Gesetz der Energieverteilung im Normalspectrum,1901,2047210381,,10.1002/andp.19013090310,,1,0
Chemistry,20154,"zsigmondy, r",1925,uber sichtbarmachung und grosenbestimmung ultramikoskopischer teilchen mit besonderer anwendung auf goldrubinglaser,1902,1981124145,,10.1002/andp.19023150102,,1,0
Medicine,30182,"einthoven, w",1924,ein neues galvanometer,1903,1967506984,,10.1002/andp.19033171308,,1,0
Physics,10180,"einstein, a",1921,uber einen die erzeugung und verwandlung des lichtes betreffenden heuristischen gesichtspunkt,1905,2005886497,,10.1002/andp.19053220607,,1,0
Physics,10180,"einstein, a",1921,zur elektrodynamik bewegter korper,1905,2048251016,,10.1002/andp.19053221004,,1,0
Chemistry,20158,"nernst, w",1920,der energieinhalt fester stoffe,1911,2059200827,,10.1002/andp.19113411207,,1,0
Chemistry,20141,"debye, p",1936,zur theorie der spezifischen warmen,1912,1972128701,,10.1002/andp.19123441404,,1,0
Physics,10187,"laue, m",1914,interferenzerscheinungen bei rontgenstrahlen,1913,2049080732,,10.1002/andp.19133461004,,1,0
Physics,10182,"stark, j",1919,beobachtungen uber den effekt des elektrischen feldes auf spektrallinien ii langseffekt,1914,2171194731,,10.1002/andp.19143480702,,1,0
Physics,10166,"schrodinger, e",1933,quantisierung als eigenwertproblem--Quantisation as an eigen value problem,1926,2159136592,,10.1002/andp.19263840404,WOS:000201915100003,0,0
Physics,10166,"schrodinger, e",1933,uber das verhaltnis der heisenberg born jordanschen quantenmechanik zu der meinem,1926,2087517811,,10.1002/andp.19263840804,,1,0
Physics,10078,"ruska, e",1986,beitrag zur geometrischen elektronenoptik ii,1932,2120730528,,10.1002/andp.19324040602,,1,0
Chemistry,20107,"ziegler, k",1963,polymerisation von athylen und anderen olefinen,1955,2154165252,,10.1002/ange.19550671610, WOS:A1955WT13000009,0,0
Chemistry,20088,"prelog, v",1975,specification of molecular chirality,1966,2102110064,,10.1002/anie.196603851,WOS:A19667635700006,0,0
Chemistry,20079,"hoffmann, r",1981,the conservation of orbital symmetry,1969,2008844584,,10.1002/anie.196907811,WOS:A1969E733100001,0,0
Chemistry,20158,"nernst, w",1920,spezifische warme und quantentheorie,1911,1921764522,,10.1002/bbpc.19110171809,,1,0
Chemistry,20159,"haber, f",1918,uber die technische darstellung von ammoniak aus den elementen,1913,1949899304,,10.1002/bbpc.19130190201,,1,0
Chemistry,20148,"fischer, h",1930,Einfluss der configuration auf die wirkung der enzyme.,1894,1992787746,,10.1002/cber.18940270364,,1,0
Chemistry,20160,"willstatter, r",1915,zur kenntnis der hydrolyse von cellulose i--Information on the hydrolysis of cellulose I,1913,1968331280,,10.1002/cber.191304602174,WOS:000201159200160,0,0
Chemistry,20151,"windaus, a",1928,"uber ein in chloroform unlosliches glykosid aus digitalis blattern das gitoxin--A glycoside obtained from digitalis leaves which is insoluble in chloroform, gitoxin",1925,2031036703,,10.1002/cber.19250580818,WOS:000201215900058,0,0
Chemistry,20138,"kuhn, r",1938,"mikro bestimmung von acetyl benzoyl und c methylgruppen--Micro classification of acetyl-, benzoyl- and C-methyl groups",1933,2055831527,,10.1002/cber.19330660922,WOS:000201200400075,0,0
Chemistry,20137,"butenandt, a",1939,zur isolierung und charakterisierung des corpus luteum hormons--The isolation and characterisation of the corpus-luteum hormone.,1934,2152050528,,10.1002/cber.19340670831,WOS:000201216200064,0,0
Chemistry,20137,"butenandt, a",1939,uberfuhrung des pregnandiols in corpus lutTransformation of pregnandiols in corpus-luteum-hormones.eum hormon--,1934,2064866007,,10.1002/cber.19340671126,WOS:000201216200151,0,0
Chemistry,20137,"butenandt, a",1939,notiz uber ein isomeres allo pregnanol 3 on 20--Notes on isomeres allo-pregnanol-(3)-on-(20),1935,2041102817,,10.1002/cber.19350680934,WOS:000201200600113,0,0
Chemistry,20083,"wittig, g",1979,uber triphenyl phosphin methylene als olefinbildende reagenzien i mitteil,1954,2153772742,,10.1002/cber.19540870919,WOS:A1954UL05000018,0,0
Chemistry,20120,"staudinger, h",1953,uber neue organische phosphorverbindungen iii phosphinmethylenderivate und phosphinimine--On new organic phosphorus bonding III Phosphine methylene derivatives and phosphinimine,1919,2043716459,,10.1002/hlca.19190020164,WOS:000201624100053,0,0
Chemistry,20120,"staudinger, h",1953,einwirkungen von aliphatischen diazoverbindungen auf thioketone--Action of aliphatic diazo compounds on the thioketones,1920,2045842456,,10.1002/hlca.19200030178,WOS:000201624200067,0,0
Chemistry,20120,"staudinger, h",1953,uber neue organische phosphorverbindungen iv phosphinimine--On new organic phosphorus bonding IV Phosphinimine,1921,2076493833,,10.1002/hlca.19210040192, WOS:000201624300082,0,0
Chemistry,20136,"ruzicka, l",1939,hohere terpenverbindungen viii uber die konstitution des nerolidols peruviol--Higher terpene bondings VIII. The constitution of nerolidol (peruviol),1923,1964350782,,10.1002/hlca.19230060150,WOS:000201624500047,0,0
Chemistry,20136,"ruzicka, l",1939,"hohere terpenverbindungen ix uber die totalsynthese des d l nerolidols und des farnesols--Higher terpene bondings IX. The total synthesis of d,l-nerolidol and of farnesol",1923,2072973533,,10.1002/hlca.19230060151,WOS:000201624500048,0,0
Chemistry,20136,"ruzicka, l",1939,hohere terpenverbindungen xxiv ringbildungen bei sesquiterpenen totalsynthese des bisabolens und eines hexahydro cadalins--Higher terpene bonds XXIV Ring formation of sesquiterpenes - Total synthesis of bisabolen and a hexahydro cadalin,1925,1982719436,,10.1002/hlca.19250080144,WOS:000201624700039,0,0
Chemistry,20139,"haworth, w",1937,the structure of carbohydrates,1928,2080334091,,10.1002/hlca.19280110166,WOS:000201625000059,0,0
Chemistry,20140,"karrer, p",1937,zur kenntnis des vitamins a aus fischtranen,1931,2163189310,,10.1002/hlca.19310140511,,1,0
Medicine,30152,"reichstein, t",1950,eine ergiebige synthese der l ascorbinsaure c vitamin--A productive synthesis of l-arcorbic acid (C-vitamin),1934,2000315362,,10.1002/hlca.19340170136,WOS:000201625600031,0,0
Medicine,30152,"reichstein, t",1950,desoxy cortico steron 21 oxy progesteron aus 5 3 oxy atio cholensaure--Desoxy-corticosterone (21-oxy-progesterone) from Delta(5)-3-oxy-ethyl-cholic acid (XII. Communication on components of kidney lobes),1937,2036574905,,10.1002/hlca.193702001158,WOS:000201625800139,0,0
Physics,10141,"shockley, w",1956,the theory of p n junctions in semiconductors and p n junction transistors,1949,2062624166,,10.1002/j.1538-7305.1949.tb03645.x,WOS:A1949UH04300006,0,0
Physics,10019,"boyle, ws",2009,charge coupled semiconductor devices,1970,2113742150,,10.1002/j.1538-7305.1970.tb01790.x,WOS:A1970G075800006,0,0
Chemistry,20024,shimomur.o,2008,extraction purification and properties of aequorin a bioluminescent protein from the luminous hydromedusan aequorea,1962,2084312697,,10.1002/jcp.1030590302,WOS:A19624094B00012,0,0
Chemistry,20160,"willstatter, r",1915,untersuchungen uber die anthocyane i uber den farbstoff der kornblume,1913,1973911009,,10.1002/jlac.19134010205,,1,0
Chemistry,20151,"windaus, a",1928,untersuchungen uber die konstitution des colchicins,1924,1987925710,,10.1002/jlac.19244390106,,1,0
Chemistry,20125,"alder, k",1950,synthesen in der hydroaromatischen reihe,1928,2000547662,,10.1002/jlac.19284600106,,1,0
Chemistry,20083,"wittig, g",1979,zur reaktionsweise des pentaphenyl phosphors und einiger derivate,1953,2146184169,,10.1002/jlac.19535800107,WOS:A1953XV09400006,0,0
Chemistry,20027,"chauvin, y",2005,catalyse de transformation des olefines par les complexes du tungstene ii telomerisation des olefines cycliques en presence d olefines acycliques,1971,1621500924,,10.1002/macp.1971.021410112,,1,0
Chemistry,20054,"crutzen, p",1995,the influence of nitrogen oxides on the atmospheric ozone content,1970,1971991115,,10.1002/qj.49709640815,WOS:A1970G322300014,0,0
Chemistry,20036,"tanaka, k",2002,Protein and polymer analyses up to m/z 100 000 by laser ionization timeofflight mass spectrometry,1988,2110174460,,10.1002/rcm.1290020802,,0,1
Chemistry,20113,"heyrovsky, j",1959,researches with the dropping mercury cathode part ii the polarograph,2010,2067877546,,10.1002/recl.19250440606,WOS:000201273200053,0,0
Chemistry,20161,"richards, t",1914,revision des atomgewichtes von casium--Revision of the atomic weight of casium,1903,1542301768,,10.1002/zaac.19030340131,WOS:000202106100004,0,0
Chemistry,20161,"richards, t",1914,revision der atomgewichte von natrium und chlor--Review of atomic weight of natrium and chlorine,1905,2089851537,,10.1002/zaac.19050470108,WOS:000202120100007,0,0
Medicine,30179,"warburg, o",1931,uber die wirkung des kohlenoxyds auf den stoffwechsel der hefe,1928,14753086,,10.1007/978-3-642-47774-4_20,,1,0
Medicine,30179,"warburg, o",1931,uber die geschwindigkeit der photochemischen kohlensaurezersetzung in lebenden zellen ii,1928,1593702539,,10.1007/978-3-642-47774-4_26,,1,0
Physics,10127,"wigner, ep",1963,on the interaction of electrons in metals,1934,2049635189,,10.1007/978-3-642-59033-7_36,WOS:000201515700010,0,0
Physics,10144,"born, m",1954,zur quantenmechanik ii,1926,2059245145,,10.1007/978-3-642-61659-4_27,,1,0
Medicine,30102,karl von frisch,1973,Aus dem Leben der Bienen,1927,1785442005,,10.1007/978-3-642-64923-3,,1,0
Physics,10136,"frank, i",1958,coherent visible radiation of fast electrons passing through matter,1937,1773401776,,10.1007/978-3-642-74626-0_2,,1,0
Medicine,30129,"wilkins, mhf",1962,molecular structure of deoxypentose nucleic acids,1953,1502527096,,10.1007/978-3-662-47150-0_6,WOS:A1953UA43400008,0,0
Physics,10139,"bardeen, j",1956,surface states and rectification at a metal semi conductor contact,1947,2029526589,,10.1007/978-94-009-0657-0_7,WOS:A1947UB27700013,0,0
Physics,10104,"ryle, m",1974,solar radiation on 175 mc s,1946,2072256285,,10.1007/978-94-009-7752-5_18,WOS:A1946UA27000010,0,0
Physics,10076,"binnig, g",1986,surface studies by scanning tunneling microscopy,1982,2110167104,,10.1007/978-94-011-1812-5_1,WOS:A1982NV44300017,0,0
Chemistry,20045,"pople, j",1998,the influence of polarization functions on molecular orbital hydrogenation energies,1973,2094642658,,10.1007/BF00533485,WOS:A1973O806700001,0,0
Physics,10129,"mossbauer, rl",1961,kernresonanzabsorption von gammastrahlung in ir191,1958,1966484500,,10.1007/BF00632050,,1,0
Medicine,30059,"sakmann, b",1991,improved patch-clamp techniques for high-resolution current recording from cells and cell-free membrane patches,1981,2009667219,,10.1007/BF00656997,WOS:A1981ME31100001,0,0
Physics,10074,"muller, ka",1987,possible high tc superconductivity in the ba la cu o system,1986,1485300768,,10.1007/BF01303701,WOS:A1986D856200010,0,0
Physics,10158,"stern, o",1943,the magnetic moment of silver atoms,1922,2596075454,,10.1007/BF01326984,WOS:000201793200030,0,0
Physics,10168,"heisenberg, w",1932,zur theorie des ferromagnetismus--On the Theory of Ferromagnetism,1928,2079751966,,10.1007/BF01328601,WOS:000207403700002,0,0
Physics,10158,"stern, o",1943,der experimentelle nachweis des magnetischen moments des silberatoms,1922,2069807188,,10.1007/BF01329580,,1,0
Physics,10145,"bothe, w",1954,"uber das wesen des comptoneffekts ein experimenteller beitrag zur theorie der strahlung--Regarding the nature of the Compton effect, an experimental contribution to the theory of irradiation",1925,1986884324,,10.1007/BF01331702,WOS:000201795300057,0,0
Physics,10144,"born, m",1954,beweis des adiabatensatzes--Proof of Adiabatic law,1928,2031828766,,10.1007/BF01343193,WOS:000207405000001,0,0
Physics,10129,"mossbauer, rl",1961,kernresonanzfluoreszenz von gammastrahlung in ir191,1958,2016797896,,10.1007/BF01344210,WOS:A1958WQ74000004,0,0
Physics,10160,"fermi, e",1938,an attempt of a theory of beta radiation 1,1934,2128675669,,10.1007/BF01351864,WOS:000207421400002,0,0
Physics,10144,"born, m",1954,quantenmechanik der stosvorgange--Quantum mechanics in impact processes,1926,1989868128,,10.1007/BF01397184,WOS:000201848800001,0,0
Physics,10144,"born, m",1954,zur quantenmechanik der stosvorgange--The quantum mechanics of the impact process,1926,1989440127,,10.1007/BF01397477,WOS:000201816900001,0,0
Chemistry,20134,"hahn, o",1944,uber den nachweis und das verhalten der bei der bestrahlung des urans mittels neutronen entstehenden erdalkalimetalle--About the evidence and the behavior in uranium radiation using neutron occuring earth alkaloid metals,1939,2074403122,,10.1007/BF01488241,WOS:000200263600002,0,0
Medicine,30103,"lorenz, k",1973,ber die Bildung des Instinktbegriffes--On the formation of instinctual perceptions.,1937,2029111077,,10.1007/BF01491749, WOS:000200263700043,0,0
Physics,10166,"schrodinger, e",1933,der stetige ubergang von der mikro zur makromechanik--The constant crossover of micro- to macro mechanics,1926,1884836326,,10.1007/BF01507634,WOS:000200263300134,0,0
Medicine,30185,"meyerhof, o",1922,uber die atmung der froschmuskulatur--Respiration in the musculature of frogs.,1919,2073406286,,10.1007/BF01722140,WOS:000201193700002,0,0
Medicine,30172,"loewi, o",1936,uber humorale ubertragbarkeit der herznervenwirkung--On humoral transmissibility of heart-nerve effect. VI. Announcement. The point of contact of atropine.,1924,1499186559,,10.1007/BF01722757,WOS:000201202600010,0,0
Medicine,30154,"hess, wr",1949,hypothalamus und die zentren des autonomen nervensystems physiologie--Hypothalamus and the centres of the autonomic nervous system Physiology,1936,2009015488,"The diencephalon of both human and animal brains has cells that govern many behaviors. During the 1930s Walter Hess inserted a narrow metal thread into different parts of anesthetized cats' hypothalamus, an area on the underside of the diencephalon. When the cats awoke, he could trigger different behaviors with weak electrical impulses to different parts of the hypothalamus - not just simple reactions but complex behaviors. Among other things, the cats could be made to display defensive and aggressive behaviors and to curl up and go to sleep.",10.1007/BF01814243,WOS:000202493000026,0,0
Medicine,30103,"lorenz, k",1973,Der Kumpan in der Umwelt des Vogels,1935,1999595872,,10.1007/BF01905355,,1,0
Medicine,30173,"spemann, h",1935,uber induktion von embryonalanlagen durch implantation artfremder organisatoren,1924,2048075051,,10.1007/BF02108176,,1,0
Chemistry,20088,"prelog, v",1975,the specification of asymmetric configuration in organic chemistry,1956,2053032227,,10.1007/BF02157171,WOS:A1956WS95600001,0,0
Chemistry,20088,"prelog, v",1975,description of steric relationships across single bonds,1960,2009828525,,10.1007/BF02158433,WOS:A1960WT07400001,0,0
Chemistry,20152,"wieland, h",1927,uber den mechanismus der oxydationsvorgange,1922,2314460680,,10.1007/BF02322468,,1,0
Physics,10090,"salam, a",1979,weak and electromagnetic interactions,1968,2078536640,,10.1007/BF02726525,WOS:A1959WM39800009,0,0
Physics,10115,"gellmann, m",1969,the axial vector current in beta decay,1960,2101447717,,10.1007/BF02859738,WOS:A1960WM44000008,0,0
Physics,10156,"pauli, w",1945,uber den zusammenhang des abschlusses der elektronengruppen im atom mit der komplexstruktur der spektren--On the connection of the arrangement of electron groups in atoms with the complex structure of spectra,1925,2091489183,,10.1007/BF02980631,WOS:000201795200075,0,0
Physics,10035,"leggett, aj",2003,the spin dynamics of an anisotropic fermi supefluid 3he,1974,2066009244,,10.1016/0003-4916(74)90277-2,WOS:A1974T308400002,0,0
Physics,10035,"leggett, aj",2003,quantum tunnelling in a dissipative system,1983,2009902266,,10.1016/0003-4916(83)90202-6,WOS:A1983RL61300007,0,0
Medicine,30091,"schally, av",1977,the identity of chemical and hormonal properties of the thyrotropin releasing hormone and pyroglutamyl histidyl proline amide,1969,2130799585,,10.1016/0006-291X(69)90868-7,WOS:A1969E586400025,0,0
Medicine,30091,"schally, av",1977,discovery of modification of the synthetic tripeptide sequence of the thyrotropin releasing hormone having activity,1969,2014610831,,10.1016/0006-291X(69)90889-4,WOS:A1969E285800020,0,0
Medicine,30077,samuelss.b,1982,prostaglandin endoperoxides vii novel transformations of arachidonic acid in guinea pig lung,1974,2035879817,,10.1016/0006-291X(74)90246-0,WOS:A1974V223700017,0,0
Medicine,30124,"lynen, f",1964,enzymes of fatty acid metabolism,1953,1965802835,,10.1016/0006-3002(53)90149-8,WOS:A1953YC43800011,0,0
Medicine,30057,"fischer, eh",1992,The phosphorylase b to a converting enzyme of rabbit skeletal muscle,1956,2071356747,,10.1016/0006-3002(56)90273-6 ,WOS:A1956WF16900020,0,0
Chemistry,20049,"skou, j",1997,the influence of some cations on an adenosine triphosphatase from peripheral nerves,1957,2058236257,,10.1016/0006-3002(57)90343-8,WOS:A1957WJ92400019,0,0
Medicine,30006,"okeefe, j",2014,the hippocampus as a spatial map preliminary evidence from unit activity in the freely moving rat,1971,2052515926,,10.1016/0006-8993(71)90358-1,WOS:A1971K844700012,0,0
Medicine,30012,"gurdon, jb",2012,adult frogs derived from the nuclei of single somatic cells,1962,2094753906,,10.1016/0012-1606(62)90043-X,WOS:A19621045B00003,0,0
Medicine,30036,"sulston, je",2002,post embryonic cell lineages of the nematode caenorhabditis elegans,1977,1986006829,,10.1016/0012-1606(77)90158-0,WOS:A1977CY53300009,0,0
Medicine,30039,"hartwell, lh",2001,genetic control of the cell division cycle in yeast iv genes controlling bud emergence and cytokinesis,1971,2057764157,,10.1016/0014-4827(71)90223-0,WOS:A1971L218500003,0,0
Medicine,30001,"ohsumi, y",2016,isolation and characterization of autophagy defective mutants of saccharomyces cerevisiae,1993,2011580247,,10.1016/0014-5793(93)80398-E,WOS:A1993MC88100036,0,0
Medicine,30090,"smith, ho",1978,a restriction enzyme from hemophilus influenzae i purification and general properties,1970,1506010125,,10.1016/0022-2836(70)90149-X,WOS:A1970H020500015,0,0
Medicine,30090,"smith, ho",1978,a restriction enzyme from hemophilus influenzae ii base sequence of the recognition site,1970,1534152204,,10.1016/0022-2836(70)90150-6,WOS:A1970H020500016,0,0
Chemistry,20010,"levitt, m",2013,theoretical studies of enzymic reactions dielectric electrostatic and steric stabilization of the carbonium ion in the reaction of lysozyme,1976,2004303971,,10.1016/0022-2836(76)90311-9,WOS:A1976BR81800002,0,0
Chemistry,20082,"berg, p",1980,labeling deoxyribonucleic acid to high specific activity in vitro by nick translation with dna polymerase i,1977,2029987769,,10.1016/0022-2836(77)90052-3,WOS:A1977DM10700015,0,0
Chemistry,20057,"smith, m",1993,the nucleotide sequence of bacteriophage x174,1978,1969094530,,10.1016/0022-2836(78)90346-7,WOS:A1978FW60600007,0,0
Chemistry,20066,"michel, h",1988,three dimensional crystals of a membrane protein complex the photosynthetic reaction centre from rhodopseudomonas viridis,1982,1488248212,,10.1016/0022-2836(82)90216-9,WOS:A1982NW47700015,0,0
Chemistry,20035,"wuthrich, k",2002,solution conformation of proteinase inhibitor iia from bull seminal plasma by 1h nuclear magnetic resonance and distance geometry,1985,1986379760,,10.1016/0022-2836(85)90347-X,WOS:A1985AFQ7500011,0,0
Physics,10063,"charpak, g",1992,the use of multiwire proportional counters to select and localize charged particles,1968,2039785230,,10.1016/0029-554X(68)90371-6,WOS:A1968B394200004,0,0
Physics,10085,"siegbahn, k",1981, ray spectroscopy in the precision range of 1 105,1956,1993527439,,10.1016/0029-5582(56)90015-3,WOS:A1956WP50000001,0,0
Physics,10092,"glashow, sl",1979,partial symmetries of weak interactions,1961,2232454336,,10.1016/0029-5582(61)90469-2,WOS:A19619071B00008,0,0
Chemistry,20086,"prigogine, i",1977,dynamical and statistical descriptions of n body systems,1969,2047085243,,10.1016/0031-8914(69)90270-5,WOS:A1969E929000012,0,0
Physics,10108,"josephson, bd",1973,possible new effects in superconductive tunnelling,1962,2566706182,,10.1016/0031-9163(62)91369-0,WOS:A1962WU06500005,0,0
Physics,10010,"higgs, pw",2013,broken symmetries massless particles and gauge fields,1964,2223433365,,10.1016/0031-9163(64)91136-9,WOS:A1964WM38800031,0,0
Chemistry,20025,"ertl, g",2007,adsorption of hydrogen on palladium single crystal surfaces,1974,2037712575,,10.1016/0039-6028(74)90060-0,WOS:A1974S114500010,0,0
Chemistry,20025,"ertl, g",2007,adsorption of co on pd single crystal surfaces,1974,1999433310,,10.1016/0039-6028(74)90270-2,WOS:A1974T480800009,0,0
Chemistry,20025,"ertl, g",2007,adsorption of hydrogen on a pt 111 surface,1976,2071890513,,10.1016/0039-6028(76)90232-6,WOS:A1976BG05100012,0,0
Chemistry,20025,"ertl, g",2007,chemisorption of co on the pt 111 surface,1977,2093254131,,10.1016/0039-6028(77)90052-8,WOS:A1977DL66800002,0,0
Medicine,30136,"ochoa, s",1959,116 isocitric dehydrogenase system tpn from pig heart,1955,2200933292,,10.1016/0076-6879(55)01121-X,WOS:A1955WN96500116,0,0
Medicine,30136,"ochoa, s",1959,124 malic enzyme,1955,2206310676,,10.1016/0076-6879(55)01129-4,WOS:A1955WN96500124,0,0
Medicine,30056,"roberts, rj",1993,an amazing sequence arrangement at the 5 ends of adenovirus 2 messenger rna,1977,1996948250,,10.1016/0092-8674(77)90180-5,WOS:A1977DV77200001,0,0
Medicine,30055,"sharp, pa",1993,Sizing and mapping of early adenovirus mRNAs by gel electrophoresis of S1 endonuclease-digested hybrids,1977,2054073262,,10.1016/0092-8674(77)90272-0,WOS:A1977EB00100016,0,0
Medicine,30009,"schekman, r",2013,identification of 23 complementation groups required for post translational events in the yeast secretory pathway,1980,2059775037,,10.1016/0092-8674(80)90128-2,WOS:A1980KE07200020,0,0
Medicine,30024,"capecchi, mr",2007,high efficiency transformation by direct microinjection of dna into cultured mammalian cells,1980,2061555550,,10.1016/0092-8674(80)90358-X,WOS:A1980KU63800019,0,0
Medicine,30017,"szostak, jw",2009,cloning yeast telomeres on linear plasmid vectors,1982,1977437036,,10.1016/0092-8674(82)90109-X,WOS:A1982NR76000028,0,0
Chemistry,20062,"cech, t",1989,self splicing rna autoexcision and autocyclization of the ribosomal rna intervening sequence of tetrahymena,1982,1968282235,,10.1016/0092-8674(82)90414-7,WOS:A1982PQ46100017,0,0
Chemistry,20063,"altman, s",1989,the rna moiety of ribonuclease p is the catalytic subunit of the enzyme,1983,2021333801,,10.1016/0092-8674(83)90117-4,WOS:A1983RX39200029,0,0
Chemistry,20006,"sancar, a",2015,a novel repair enzyme uvrabc excision nuclease of escherichia coli cuts a dna strand on both sides of the damaged region,1983,2033860973,"Living cells have DNA molecules that carry an organism's genes. For the organism to live and develop, its DNA cannot change. DNA molecules are not completely stable, and they can be damaged. In 1983, through studies of bacteria, Aziz Sancar showed how certain protein molecules, certain repair enzymes, repair DNA damaged by ultraviolet (UV) light. These discoveries have increased our understanding of how the living cell works, the causes of cancer and aging processes.",10.1016/0092-8674(83)90354-9,WOS:A1983QS06800033,0,0
Medicine,30038,"hunt, t",2001,cyclin a protein specified by maternal mrna in sea urchin eggs that is destroyed at each cleavage division,1983,2090827556,,10.1016/0092-8674(83)90420-8,WOS:A1983QV90600015,0,0
Medicine,30018,"greider, cw",2009,identification of a specific telomere terminal transferase activity in tetrahymena extracts,1985,2122740168,,10.1016/0092-8674(85)90170-9,WOS:A1985AVR1200003,0,0
Medicine,30034,"horvitz, hr",2002,genetic control of programmed cell death in the nematode c elegans,1986,1969331809,,10.1016/0092-8674(86)90004-8,WOS:A1986A741800002,0,0
Medicine,30037,"nurse, p",2001,negative regulation of mitosis by wee1 a gene encoding a protein kinase homolog,1987,2038340312,,10.1016/0092-8674(87)90458-2,WOS:A1987H430500014,0,0
Medicine,30024,"capecchi, mr",2007,site directed mutagenesis by gene targeting in mouse embryo derived stem cells,1987,1993834457,,10.1016/0092-8674(87)90646-5,WOS:A1987K785400017,0,0
Medicine,30030,"buck, l",2004,a novel multigene family may encode odorant receptors a molecular basis for odor recognition,1991,2097186487,,10.1016/0092-8674(91)90418-X,WOS:A1991FF77300019,0,0
Medicine,30010,"rothman, je",2013,a protein assembly disassembly pathway in vitro that may correspond to sequential steps of synaptic vesicle docking activation and fusion,1993,1971016259,,10.1016/0092-8674(93)90376-2,WOS:A1993MF83000004,0,0
Medicine,30008,"sudhof, tc",2013,synaptotagmin i a major ca2 sensor for transmitter release at a central synapse,1994,2165302477,,10.1016/0092-8674(94)90556-8,WOS:A1994PT48100018,0,0
Physics,10080,"rubbia, c",1984,experimental observation of lepton pairs of invariant mass around 95 gev c2 at the cern sps collider,1983,1996888950,,10.1016/0370-2693(83)90188-0,WOS:A1983QY36100023,0,0
Physics,10080,"rubbia, c",1984,experimental observation of isolated large transverse energy electrons with associated missing energy at sqrt s 540 gev,1983,1674199955,,10.1016/0370-2693(83)91177-2,WOS:A1983QD93800022,0,0
